Event_Date,Report_ID,Summary
02/11/2014,0950647,"At approximately 7:00 p.m. on February 11, 2014, an employee was working as a heavy equipment operator for a firm engaged in oilfield construction and maintenance. It had 350 workers. The employee had worked his shift as a heavy equipment operator and was riding in an air-conditioned pickup truck traveling to an offsite meeting. When a coworker who was driving the truck stopped, he noticed that the employee would not wake up. Emergency medical services were contacted, and they responded to the location. The employee was transported by ambulance to Mercy Hospital in Bakersfield, where he was admitted. He died several days later. The employee's supervisor was not present during this incident. The employer notified the Division of the incident at 9:23 a.m. that same day. The Division opened an investigation with the employer on February 20, 2014. The investigation concluded that the employee's medical event was idiopathic in nature and that there was no other cause for the incident. The narrative did not go into further details regarding the nature of the medical event. As a result of the investigation, the Division issued the employer a regulatory citation."
01/13/2014,0215000,"On January 13, 2014, an employee was clearing dirt around a gas main pipe to  expose it for an excavation.  The employee collapsed and died from a heart  attack."
12/04/2013,0950643,"At approximately 7:50 a.m. on December 4, 2013, Employee #1, a driller, and Coworker #1, both employed by Pacific Coast Well Drilling, Inc., were working at an excavation site, assigned to drill a water well. Employee #1 was in the process of breaking out the drill pipe. He put a 60-inch pipe wrench on the pipe below the rotary table. After engaging the rotary table, the pipe wrench rotated, striking Employee #1's right leg and pinning it between the pipe wrench and the rig. Emergency services were called, and the Santa Barbara County Fire Department responded. Employee #1 was transported by ambulance to Marian Medical Center, where he was admitted and treated for a fracture of the right tibia and fibula. His injury required surgery, and he remained hospitalized for five days. Cal/OSHA was notified of this event by the employer at 9:40 a.m. on December 4, 2013, and by the Santa Barbara County Fire Department at 10:25 a.m. on December 4, 2013. Cal/OSHA initiated its investigation at 8:15 a.m. on December 16, 2013. Cal/OSHA conducted interviews with Employee #1, Coworker #1, and the supervisor. Based on its findings, Cal/OSHA issued a Serious Accident Related citation for CCR, Title 8, 6655(d)."
08/29/2013,0522500,"At 10:00 a.m. on August 29, 2013, Employee #1 was working at a pipeline  installation construction site, operating a crane down a 12 degree hill,  carrying sections of pipe from the bottom of the hill to the top. Employee #1  was going to pick up another section of pipe when the brakes on the crane that  he was operating failed, causing the crane to slide down the hill. The  employee attempted to jump free from the path of the crane, however, he was  struck by the boom of the crane and was killed."
08/22/2013,0626700,"At 10:45 a.m. on August 22, 2013, Employee #1, was working as a flagger on a  highway for a crude pipeline installation job. A motorist driving a pick up  truck failed to follow the stop sign and struck the employee with his vehicle,  carrying him approximately 150 feet. Employee #1 was killed on impact."
08/21/2013,0626600,"At 8:15 a.m. on August 21, 2013, Employee #1 was rotating the turntable of a  Kamatsu 270 excavator as lubricant was being applied.  Prior to rotating the  turn table, the boom and bucket were lifted seven feet to clear any  obstructions around the vehicle, and to make it easier to lubricate. As  Employee #1 began to spin the turn table clockwise, the right-side knuckle of  the boom struck a 7,200 KV power line which was above the excavator.  Employee  #1 was electrocuted and killed."
08/11/2013,0626000,"At 10:00 p.m. on August 11, 2013, Employee #1 placed the jaws of a 60 inch  pipe wrench on a 20 foot pipe section that was going to be installed into the  preceeding pipe. The pipe wrench was used as a ""back-up"" to hold the pipe  section in place while a boring machine threaded the pipe sections together.  As the pipeline was rotated by the boring machine, it became wedged in the  bore and then suddenly sprang free, creating a spinning, rotating hazard.  Employee #1, who was holding the pipe wrench, was struck on the right side of  his head by the flying pipe wrench, crushing his skull, and killing him."
07/03/2013,0830600,"At 12:45 p.m. on July 3, 2013, an employee was struck by a flying shackle  caused by a sudden release of tension when pulling a 16 inch pipe into a hole  by a track excavator.  The shackle was rated as having a 17 ton lifting  capacity with a 1- 17.32 diameter threaded pin.  The employee was killed when  struck by the shackle."
06/20/2013,0950612,"On June 20, 2013, Employee #1, of Underground Construction Co. Inc., was working at a pipeline construction site. As he was installing plastic sheeting under a portable toilet, he collapsed. Emergency services were called. Employee #1 was transported to Watsonville Community Hospital. Employee #1 died. The subsequent investigation report did not reveal a cause of death."
05/21/2013,0625400,"At 10:55 a.m. on May 21, 2013, an employee was driving a side boom  tractor/pipelayer up a steep hill with an approximately 17 degree incline. The  employee lost control of the machine as it traveled down the hill striking the  trencher machine and landing in the trench crushing the employee in between  the trench and the machine killing him."
04/22/2013,0626600,"At 10:07 a.m. on April 22, 2013, an employee was picking up pieces of wood  called skids to set under pipes waiting to be moved into the excavation. Loose  skids were in proximity of the excavator, and the employee was walking towards  the working excavator and stationary pipe. Employee #1 entered the swing area  of a Komatsu PC310LC-10 hydraulic excavator and he couldn't hear the formen  and spotter yelling at him to get out of the swing area. Employee #1 was  caught between the excavator's counterweight and the staged piping. Employee  #1 died at the scene from his injuries. The employee sustained crushing  injuries of the chest and shoulder."
04/18/2013,0627700,"At 2:00 p.m. on April 18, 2013, an employee and a co-worker were rigging a  pipe to the side boom. The side boom operator started manuvering the pipe,  moving the side boom in reverse, and in an angled direction.  The employee was  still holding onto the pipe on the side next to the side boom as the tag-line  holder (the co-worker) grabbed the pipe from the opposite side, away from the  side boom.  The employee was walking behind the side boom as it travelled in a  reverse direction.  Just before getting to the pipe bender, apparently the  employee somehow fell and was run over by the side boom as it travelled  backwards. The employee was then crushed by the side boom as the track of the  side boom ran over the employee. He was killed."
03/13/2013,0950647,"On March 13, 2013, an industrial forklift operator, employed by TIC - The Industrial Company, a power plant/industrial contractor, was driving on a narrow paved public road. He was proceeding to a construction lease site to pick up a load of acetylene and oxygen tanks. He was driving a JLG Telehandler Model G12-55A with telescoping boom, Serial Number 0160037826, manufactured in 2009 by JLG Industries Inc. As the road he was driving on traversed a hillside, the forklift rolled over and off the hill. Employee #1 was transported to Kern Medical Center, admitted to the intensive care unit (ICU), and treated for a serious head fracture. After two weeks in ICU, Employee #1 died."
02/16/2013,0627510,"At 12:00 p.m. on February 16, 2013, an employee was spotting for a bulldozer  operator. When the D8 bulldozer stopped briefly, the employee jumped on the  tracks and was killed from crushing injuries."
01/09/2013,0854910,"On January 9, 2013, Employee #1, employed by an oil and gas pipeline contractor, was working on a pipeline construction project. He was setting a 40-foot section of 12-inch pipe into the bending machine. The machine started to slide on the frozen ground. The employee wrapped his arm around the pipe to prevent the machine from sliding. The bending machine fell into the trench. The employee, who was holding onto the pipe, was pushed into the trench and struck on the head. The employee was killed."
