Event_Date,Report_ID,Summary
07/10/2014,0627700,"At 3:00 a.m. on July 10, 2014, an employee was working for a firm that  provided support activities for oil and gas operations. He was one of a group  of workers at a gas or oil well, installing production casing. The job was  being done by drilling rig and casing contractors. He and others were tailing  the bottom end of a section of casing pipe into the collar of the previous  section. The oil well casing pipe was 114 millimeters (4.5 inches) in  diameter. Drilling rig drillers were operating the rig draw-works. At the same  time, a casing crew was making the pipe connections, handling the casing pipe  on the catwalk,  and operating the trough truck. As a section of casing pipe  was being hoisted by the rig and guided into position by the casing crew, the  casing crew missed inserting the pipe into the previously inserted section of  casing collar. The pipe was caught on the edge. The employee, trying to push  the pipe end into position, braced his back against the casing flag pipe. At  the same time, the rig blocks drifted downward, contacting the top of the  pipe. This motion put enough force to bow the pipe section. The assistant  driller operating the rig had not seen the blocks descending or applied the  draw-works brake handle. Suddenly, the pipe bottom broke loose.  It struck the  employee from his mid-abdomen to his head.  He sustained blunt force trauma to  the head and upper body. The employee was taken from the rig to the ground, He  was bleeding from his ears and nose, and he was unresponsive.  He was loaded  in a pickup and taken to a hospital.  He was declared brain dead on July 11,  2014, and he was declared dead at about 1:30 p.m. on July 13, 2014."
07/03/2014,0625400,"At 2:00 p.m. on July 3, 2014, an employee was working for a firm engaged in  oil and gas well drilling. He was on a derrick and he was moving a drill  collar. The employee was wearing personal protective equipment and the  attachment point on his safety harness failed. He fell 17.7 meters (58 feet).  He sustained injuries from contact with the rig floor and the drill collar pup  joint and he was killed. Another worker was injured, but he was not  hospitalized."
06/24/2014,0830500,"At 10:45 a.m. on June 24, 2014, an employee was gauging and obtaining samples  of crude oil from a 400 gallon tank that was interconnected with other  producing tanks.  The employee was found collapsed over the thief hatch where  hydrocarbon gases including methane and propane escaped from.  The coroner  declared the employees death to be from cardiac arrest as results from a #4  gas data logger were not available."
06/23/2014,0830300,"At 5:00 p.m. on June 23, 2014, an employee was driving a company truck and  appears to have suffered a heart attack."
06/21/2014,0627700,"At 9:00 a.m. on June 21, 2014, an employee was checking the drilling rig  operations and fell approximately 30 feet.  There were guard rails in place  and the employee either fell between them or over the top.  The employee was  killed."
06/19/2014,0625700,"At 10:00 p.m. on June 19, 2014, Employee #1 and Employee #2 assembled three  pieces of piping together to bridge a 3.5 foot gap between joints for a frack  stack.  Both employees performed a series of opening and closing of the wing  valve on the frack stack to build up pressure in the line.  There was a leak  in one of the coupling and they took turns hammering on the coupling to  tighten it.  One end of the piping tore away from its threads and broke at  another point, blowing the pressurized piping.  Employee #1 was struck in the  head and Employee #2 was impaled by the end of the piping."
06/09/2014,0627510,"At 2:00 p.m. on June 9, 2014, an employee was standing on the ground and  operating a metal control handles mounted to the left rear of the truck to  raise its mast.  The employee was electrocuted when the mast that was being  raised struck a high voltage power line that was overhead."
05/05/2014,0830300,"At 4:30 p.m. on May 5, 2014 an employee was operating the controls of a  workover rig. The employee began to feel increasingly ill as the workday  progressed. At approximately 1600 the employee asked for relief from his duty  station at the controls of the workover rig because he was feeling too ill to  continue work. The employee's illness became so great that coworkers felt he  was experiencing a heart attack and transported him to the hospital. The  employee suffered cardiac arrest and died."
04/30/2014,0627510,"At 12:00 a.m. on April 30, 2014, flow-back employees opened the 4H well head  that was connected to a sand separator which was under pressure. The sand  separator is connected to a sand box collector on one end and a manifold on  the other end. Employee #1 was seen closing the valve between the sand  separator and the sand box collector. The pathway from the sand separator and  the manifold were closed, including all 5 valves. Employee #2 delivered some  product and walked towards employee #1 to get a haul delivery ticket signed.  Both employees were in the pressurized zone area of wellhead #4H when the  explosion occurred. The pressure increased in the sand separator which was not  equipped with a pressure relief valve. According to witnesses, Employee #1 and  Employee #1 sustained severe head trauma from shrapnel released by the  exploded metal pressure vessel and were killed."
04/28/2014,0830300,"At 5:00 a.m. on April 28, 2014, an employee was tasked to gauge a crude oil  tank. The employee was found face down in the upper hatch of a crude oil  storage tank. The employee was asphyxiated and killed."
04/25/2014,0627500,"At 7:15 p.m. on April 25, 2014, a coworker was removing a monkey board from a  derrick by removing a pin. The monkey board shifted and fell on an employee  that was leaning on the man lift. The employee was crushed and killed."
04/20/2014,0627510,"At 9:15 p.m. on April 20, 2014, Employee #1 was part of a crew that was  installing a casing tool.  The employee was holding the tongs in position to  tighten the casing running tool while the snub line was not connected.  Employee #1 was struck-by and caught between the top drive and the pull line  of the tongs and was killed."
04/14/2014,0627700,"At 11:15 a.m. on April 14, 2014, an employee was helping erect mud pits during  derrick erection. The employee went to the tool trailer to get bolts to  install floor plate. A tractor being used as a forklift was backing up and  turning to the driver's right when the left front tire struck and knocked the  employee to the ground. The employee was caught under the forks and was  dragged approximately 20 ft. The employee sustained a fractured skull and was  killed."
04/12/2014,0625400,"At 6:45 p.m. on April 12, 2014, two employees were working from a material  basket that had been placed on a forklift. The basket was elevated  approximately 7 feet and the basket was not secured to the forklift. The  basket began to fall off the forks and Employee #1 jumped clear and Employee  #2 fell out and was struck by the material inside the basket on the back and  the chest. Employee #2 was killed."
04/12/2014,0627510,"At 10:00 a.m. on April 12, 2014, an employee collapsed while talking on phone  and died of possible heart attack."
04/05/2014,0522500,"At 3:30 p.m. on April 5, 2014, an employee was standing on the top cap of a  step ladder while disconnecting oil and gas well equipment using a mobile  crane's hoisting device. The equipment was being removed from the well head in  preparation for the well's first hydraulic fracturing operation. The equipment  weighed approximately 10,595 lbs. Two coworkers were holding the base of the  step ladder while the employee was disconnecting the well equipment. The  equipment tipped away from the employee who stepped backwards and fell  approximately 8 ft. One coworker fell in a different direction. The other  coworker ran clear of the falling equipment. The equipment tipped back towards  the employee, became disconnected from the crane's hoisting device, and fell  on the employee. The employee was crushed and killed. The coworkers were  unharmed."
04/04/2014,0627510,"At 1:30 p.m. on April 4, 2014, an employee finished changing a valve assembly  and sight glass on the bottom port of the sight glass on a 4 by 20 heater  treater then climbed the heater treater to an approximate height of 7 feet to  replace the valve assembly and sight glass on the top port of the sight glass.  The employee removed the upper valve assembly from the heater treater to  replace it, allowing oil, gas, and water to spew from the open port in the  heater treater. The employee was sprayed with a mixture containing oil, water,  and gas. The vapors from the mixture quickly ignited causing fatal burns. The  employee was wearing fire retardant clothing and was extinguished within  minutes with water. The employee was burned and died."
03/20/2014,0627700,"At 10:00 a.m. on March 20, 2014, an employee appeared to be measuring the  volume of liquid from on top of a tank battery. Later, the employee was found  unresponsive and not breathing. No additional information was provided in the  initial report that relates to the incident."
03/15/2014,0626000,"At 3:00 a.m. on March 15, 2014, an employee was standing on the rig floor  waiting to make a connection when the locking pin did not engage, causing the  machine to twist,  striking the employee on the rig floor, killing him. There  was a malfunction of the equipment."
03/15/2014,0626000,"At 8:15 a.m. on March 15, 2015, an employee was working on a battery to a  circulating pump that was located at a oil rig site.  The tool being used was  a standard wrench. Based on initial interviews, the employee was working on  the battery to a circulating pump. The battery was approximately 20 feet away  from six frac tanks.  These tanks contained oil, water, and hydrocarbons that  were floating on the water. The employees stated they saw gas vapors come from  the hatch of one of the frac tanks and a short time later, a flash fire  started from behind the tanks. Two employees were burned from the flash fire.  Employee #1 received burns to his hands and elbows.  Employee #2 received  burns to his back, arms, face, hands, and back of knee. One employee was  killed. However, the report did not specify which employee was killed."
03/14/2014,0625700,"At 1:00 p.m. on March 14, 2014, an employee went up to the high part of an old  drilling rig to cut a beam. The beam swung and the employee tried to outrun  it. The beam hit the employee, knocking him into a hole on the rig floor and  onto PVC pipes, before landing on the ground.  The employee fell approximately  60 to 70 feet and later died. The employee was not wearing fall protection."
03/12/2014,0336000,"At 9:15 a.m. on March 12, 2014, an employee was in process of refurbishing an  empty tank to be used for crude oil storage. The employee was on top of the  tank, using an acetylene torch to cut a hole in the tank lid.  The tank  erupted/exploded, throwing the lid and employee off. The employee was  found  60 feet away from the tank. He had been killed due to sustained multiple  fractures to head, neck, arms and legs and was killed."
02/28/2014,0627510,"At 12:45 a.m. on February 28, 2014, an employee was attempting to adjust the  forks on a Caterpillar forklift to pick up a casing marker joint when the  carriage fell and crushed his head."
02/24/2014,0626700,"At 2:45 p.m. on February 24, 2015, Employee #1 and Employee #2 were working as  riggers to remove a diesel engine from a rig with an 18 ton Grove crane and  two coworkers.  The coworkers comprised of a signalman and a crane operator.  The engine had been removed and the crane operator rotated the boom to the  left under the direction of the signalman.  The signalman had stopped the  crane approximately 3 to 4 feet from 7,200 volt power lines.  The engine  became stuck on the left front outrigger of the crane.  Employee #1 and  Employee #2 attempted to free the engine from the outrigger.  Once the engine  was freed the wire rope boom line contacted the power lines electrocuting  Employee #1 and Employee #2."
02/15/2014,0855610,"On February 15, 2014, Employee #1 was struck and run over by a welding truck as it was backing up to leave the area it had been parked."
02/11/2014,0317500,"At 6:45 a.m. on February 11, 2014, an employee was assisting a coworker with  checking a heater that warms a well head.  They were waiting to attend a  meeting, but had heard a ""hissing"" sound and walked toward the well heads.  They found that the heater wasn't working.  The coworker turned to walk  towards the heater unit when an explosion knocked him to the ground.  The  employee was consumed by the fire and was killed."
02/05/2014,0830300,"At 5:45 p.m. on February 5, 2014, an employee was monitoring water heaters in  an ISO container.  The employee was found on the floor by a coworker.  The  employee died of carbon monoxide poisoning."
02/03/2014,0653510,"On February 3, 2014, Employee #1 was part of a work crew who were removing a pump jack from a well site. Coworker #1 was driving around the site to unload a Samson Post, and Coworker #2 was guiding the post with a rope tag line. Employee #1 was working near the gear box located on the north side of the well site. While Coworker #1 and Coworker #2 maneuvered the post, the truck's boom was in an elevated position and came into contact with the overhead power lines located on the south side of the well site. Employee #1 came over to assist with maneuvering the post, made direct contact with his hands, and was electrocuted before being thrown back onto the ground. Coworker #1 continued to back his truck up and ran over Employee #1."
01/18/2014,0627510,"At 3:00 p.m. on January 18, 2014, an employee was performing a rig up  operation of the substructure (derrick tower). The employee used a 12 pound  sledge hammer to remove the 8 inch x 3 inch diameter pin from the left crown  support bracket and when the pin was removed the right crown support bracket  failed. The middle section of the derrick dropped approximately 16 inches  crushing employee to death. The employee was caught between the truck bed and  derrick and killed."
01/09/2014,0830600,"At 10:30 p.m. on January 9, 2014, an employee was attempting to attach a tow  strap between a Kenworth power unit and a CAT 336E track excavator.  A  coworker operating the excavator leaned out the excavator window to give  verbal instructions to the employee.  That motion caused part of the  coworker's clothing to activate the crowd arm joystick.  The crowd arm struck  the employee's head and forced it against the grill of the Kenworth power  unit, crushing it."
12/31/2013,0830300,"At 1:45 p.m. on December 31, 2013, an employee was coupling pipe sections in  the mouse hole of a drilling rig. The pipe consisted of three 30 foot  sections. As the 90-foot section of drilling pipe was lifted, its sections  came apart and fell to the ground.  The employee was struck in the head and  upper torso by the middle section of piping and was killed."
12/31/2013,0625400,"On August 8, 2012, an employee was working from a rig floor that spanned mud  pits. As the employee was moving from one location to another, the access  doors to the mud pit broke loose. The employee fell into the mud pit, which  contained a hot mud mixture, and suffered burns to 75% of his body. The  employee was hospitalized; however, died at 12:00 p.m. on December 31, 2013,  as a result of his injuries."
12/29/2013,0625400,"At 11:45 p.m. on December 29, 2013, a truck driver was disconnecting a trailer  from a truck when the vehicle began to roll backwards.  The truck driver was  run over by the truck, which pinned him under the rear wheels.  The truck  driver sustained a crushed pelvis and was killed. The incident investigation  revealed that truck and trailer wheels  were not chocked."
12/18/2013,0950643,"At approximately 8:30 a.m. on December 18, 2013, Employee #1, a rig operator, was feeding continuous rod from a rotating COROD transport wheel. The employee noticed that the rod was riding high in the reel and with his right hand pushed the rod down. The rod came back up and caught the tip of his leather glove between the rod and inside rail of the reel resulting in a right ring finger tip amputation. The District Manager was called and he drove the rig operator to Coast Occupational Medical Group and then to Saint John's Regional Medical Center, where he was treated for a right ring finger distal phalanx amputation."
12/17/2013,0950647,"At approximately 12:15 p.m. on December 13, 2013, Employee #1, an Industrial Painter, was spraying a flammable coating on the inside walls of a large trailer-mounted steel tank. The employee was also a portable halogen light and a fire ensued. Employee #1 was almost finished spray coating the inside the tank near the hatch. Spray vapor from the flammable coating migrated towards the halogen light that was near the hatch and igniting a fire inside the tank. Two coworkers saw the fire and removed Employee #1 by pulling him by his waist belt and hands out of the tank. The employee was transported via ambulance to San Joaquin Community Hospital, Burn Unit where he was treated for multiple burns. Employee #1 was hospitalized for three days."
12/17/2013,0626000,"At 11:15 a.m. on December 17, 2013, an employee was assisting a welder to  repair a leak on a tank.  The tank was located on the bed of a tractor  trailer. The employee entered the tank to hold a patch in place while the  welder remained on the outside. As the welder applied the welding torch to the  tank, an explosion occurred.  The employee was ejected approximately 75 feet  from the tank and was killed. The incident investigation determined that  flammable gases were present in the tank that led to the explosion."
12/03/2013,0625400,"At 10:00 a.m. on December 3, 2013, an employee was moving a beam while  standing in a man basket attached to a forklift. The basket fell off of the  forks of the forklift and the employee fell approximately 20 feet to the  ground.  The forklift basket landed on the employee crushing his head and  killing him."
11/26/2013,0626700,"At 3:00 p.m. on November 26, 2013, an employee was standing behind the mobile  rig with his body leaning over the oil well valve. A coworker, a mobile rig  operator, backed up the rig and trapped the employee's body with the rear part  of the rig and the oil well valve.  The employee's chest was crushed and  pierced by the well valve."
11/25/2013,0950651,"At approximately 1:15 p.m. on November 25, 2013, Employee #1 had loaded an excavator onto a river barge that was being transported away from an island. A tugboat was pulling the barge. Employee #1 was inside the cab of the excavator as the tugboat moved the barge along. The barge may have stuck a sand bar that caused the excavator to fall off the barge and overturn in approximately 15 ft of water. The cab was buried in fine silt, which trapped Employee #1 and caused him to drown. Search and rescue divers extracted his body hours after the incident."
11/20/2013,0626000,"At 5:00 p.m. on November 21, 2013, an employee was working at a zipper  fracking site and called into the data van to ensure that a pipeline had been  depressurized before removing an end cap.  The employee began removing the cap  when it blew off with 4,000 psi and was struck in the chest and the employee  was killed."
11/12/2013,0627700,"At 11:45 p.m. on November 12, 2013, an employee was replacing a potential  transformer and connected insulated alligator clips to the transformer on the  back of the unit.  The employee had not disconnected the transformer from 120  volt power source and was holding a drill in his hand to put the cover back  onto the unit.  The employee came into contact with one of the 1,500 to 1,700  ac volt fuses."
11/04/2013,0625400,"At 2:30 a.m. on November 4, 2013, an employee was installing a BOP and stepped  between that and the rig substructure.  The employee was crushed.  No further  specific information was provided in the initial report."
10/29/2013,0627510,"At 1:00 p.m. on October 29, 2013, Employee #1 was working on a work over oil  rig, removing the first joint of tubing. The work over rig was cleaning out  the well to plug back a total depth of 3,395 feet. The rig had pumped the hole  with sand and 7 barrels of clay stabilizer. Employee #1 was standing on the  work platform near a pressurized pipe that was draining the sand and water  from the well into the mud pit. The solid steel pipe that was being used  measured 17 feet and was tethered or hobbled to a pin measuring two feet that  was stuck into the wet sand near the mud pit.  The end of the pipe had a  ninety degree fitting pointing down into the sand, but did not have sufficient  means to hold the pipe down.  Due to an increase of pressure, the pipe rose  out of the ground with enough force that it struck Employee #1 in the back of  the head, killing him."
10/09/2013,0830300,"At 9:30 a.m. on October 9, 2013, Employee #1 was removing a recycling line  clamp. As the clamp was loosened, the pressure inside the recycling line blew  the union apart, releasing oil and hydrogen sulfide gas. The employee was  knocked to the ground and overcome by the hydrogen sulfide gas, asphyxiating  and killing him."
09/22/2013,0625700,"At 7:30 a.m. on September 22, 2013, an employee was standing below the rig  floor and was struck in the chest by a falling section of casing pipe.  The 30  foot section of pipe was caught on a padeye located on the laydown pole and it  lifted from the trough.  Once the casing was vertical, it broke loose and fell  to the rig floor, striking the employee and killing him."
09/04/2013,0627700,"At 11:32 a.m. on September 4, 2013, an employee was attending some hoses and a  pump to transfer crude oil from a metal storage tank to a portable plastic  tank.  The employee, plastic tank, tank dike, and metal storage tank were  engulfed in flames when an explosion occurred as the plastic portable tank was  three-quarters full.  The employee was burned and was killed"
09/03/2013,0627100,"At 1:15 p.m. on September 3, 2013, an employee was servicing an oil well with  a workover rig and become overheated.  The employee suffered heat stress and  was killed."
08/28/2013,0213600,"At approximately 4:00 p.m. on August 28, 2013, Employee #1 was operating a  pulling rig jib when the top section of the pulling mast broke off.  Employee  #1 was struck in the head by the falling mast and killed."
08/23/2013,0626300,"At approximately 6:00 a.m. on August 23, 2013, Employee #1 was measuring fluid  in the bottom of a tank.  He fell and struck his head on a stairwell and  died."
08/15/2013,0522500,"At approximately 12:15 a.m. on August 15, 2013, Employee #1, a derrick hand on  an oil rig, was in the process of drilling. The crew hit water and needed to  change to a different drill. Employee #1 climbed the ladder on the rig to  access the monkey board platform to help with the changing of the drill.  He  climbed approximately 60 feet to the monkey board, which was approximately 8  to 10 feet long and approximately 7 to 8 feet wide. He was wearing a full body  harness and had access to a vertical retractable life line as well as a  lanyard to tie off at an anchor point on the monkey board. However he was not  tied off to any anchored points.  Employee #1 fell and received head and faces  traumas and was killed."
08/14/2013,0625700,"At approximately 9:00 a.m. on August 14, 2013, Employee #1 was attempting to  free the air hoist line that became hung up upon the outside portion of the  monkey board and or fingers on an oil drilling rig.  He took hold of the air  hoist wire rope and whipped it free from where it was caught but did not let  go when the rope swung out.  He was flung off of the rig floor and could not  hold on to swing back in. Employee #1 fell 30 feet to the rig deck and died of  a concussion."
08/07/2013,0653510,"On August 7, 2013, an employee was working as a flagger for the move of a rig substructure by tandem truck. As the substructure was being unloaded at the new location, the employee got between the substructure and the back of the truck. As the front of the substructure came down off of the back of the truck, it moved forward several feet trapping the employee between it and the truck. The employee was killed."
08/03/2013,0950647,"At approximately 2:30 p.m. on August 3, 2013, Employees #1, #2, and #3 were bleeding down a well that had a well pressure of 150 psi. Employee # 2 had opened the two inch valve to bleed the well down, and Employee #3 was in the process of entering the well head area. Employee #1 informed Employee #3 that the well was gassy. Employee #3 instructed Employee #1 to close the valve. Employee #1 returned to the well head area to close the valve when the gas ignited, burning him and Employee #3. Employee #1 and #3 were hospitalized. Employee #2 received minor injuries and was not hospitalized."
08/01/2013,0855610,"On August 1, 2013, Employee #1, a 29-year-old male with Rebel Testing Inc., was working with a coworker who began to lift a well water pump off the bed of a truck before Employee #1 was ready to assist with the lift. The end of the pump, near Employee #1, began to fall off the truck. Employee #1 attempted to catch the pump before it hit the ground. The weight the pump forced Employee #1 to strike his neck area against the vehicle. Employee #1 later died of a blood clot in the brain, as a result of this event."
