Event_Date,Report_ID,Summary
07/06/2017,0627510,"At 5:00 a.m. on July 6, 2017, an employee was standing on a platform looking  into the access hatch that housed the pressure hoses and lost his balance.  The employee fell onto a hose mount bracket and was stabbed, penetrating the  employee's thigh and buttocks.  The employee was hospitalized."
07/06/2017,0830500,"At 3:45 p.m. on July 6, 2017, an employee was in the back of a pick-up truck  helping layout hose. The employee was using a 2 by 4 as a brake to control the  rotation of a Bazooka reel of hose in the back of the pick-up and the truck  was driving forward laying out hose. The employee was struck in the face by  the bazooka reel that was tipping back and forth and was caught between the  drivers side of the truck bed and bazooka reel.  A coworker transported the  employee to the North Colorado Medical Center and was treated for fractured  ribs and other contusions. The employee was hospitalized and treated for his  injuries."
07/04/2017,0855610,"At 7:10 p.m. on July 4, 2017, an employee was working on a flow line to test  the blow out preventer and stepped out onto the drip pan platform to continue  working on the connection.  The employee fell approximately 15 feet from the  drip pan platform and struck the floor, suffering a fractured skull.  The  employee was hospitalized as well."
07/03/2017,0625700,"At 10:45 a.m. on July 3, 2017, an employee was operating a bucket truck to  remove a manhole cover that was stuck.  The employee was thrown from the  bucket when it was struck by the manhole cover when it was released. The  employee  fell 25 feet to the concrete pad and suffered severe head trauma.  The employee was hospitalized and treated for his injuries."
07/02/2017,0830500,"At 3:00 a.m. on July 2, 2017, an employee was working on an elevated platform  when a drill line broke and dropped the blocking configuration onto the rig  floor.  The employee tripped on a hole within the platform and fell  approximately 15 feet to the ground and landed on some iron piping.  The  employee sustained a broken rib and a chipped pelvis and was hospitalized."
07/01/2017,0626700,"At 11:45 a.m. on July 1, 2017, an employee was adjusting the gears to lower a  table and coworker energized the equipment.  The employee caught his finger  within the equipment and it was amputated.  The employee was not hospitalized."
07/01/2017,0830500,"At 4:00 a.m. on July 1, 2017, an employee was preparing the bales to rig down  casing tools.  The employee was using his hands to correct the alignment of  the bales on the rig floor when one of the bales that weighed approximately  600 lbs fell over and crushed the tip of his ring finger.  The employee  suffered a partial amputation of his finger and was hospitalized"
06/30/2017,0627510,"At approximately 10:45 a.m. on June 30, 2017, an employee was rolling pipes  with his feet. Three pipes rolled over his foot and fracture his right ankle.  The employee was hospitalized and treated for his injuries."
06/29/2017,0627510,"At 11:30 a.m. on June 29, 2017, an employee was performing routine checks of  the pumps by seeing how long the pumps had been running. While the employee  was checking the hours there was a malfunction in the pump that caused an  explosion. The employees was struck in the head with debris from the explosion  and was killed."
06/29/2017,0627510,"At 5:45 p.m. on June 29, 2017, an employee was getting ready to pull out when  he ran into a trailer which then slammed into another parked semi-truck.  A  coworker then jumped into the cab of the employee's truck and found him  hunched over with a laceration along his leg.  The employee was killed in the  collision."
06/29/2017,0627510,"On June 29, 2017, Employee #1, employed by a construction services company,  was working at a training site.  He was removing guardrails from the top of a  confined space training module when he fell, a fall height of 12 feet.  He hit  his head upon impact.  Employee #1 was killed by the fall."
06/27/2017,0636900,"At 10:45 a.m. on June 27, 2017, an employee was chaining up the pump jack to  position it in place.The pump jack was top heavy and when a coworker started  the draw works, the pump jack flipped over, striking the employee on the back.  The employee was killed when struck by a pump jack and the counter weights."
06/21/2017,0830500,"At 5:15 a.m. on June 21, 2017, an employee was disassembling a hammer union on  a pipe manifold while re-configuring a CBS unit for better alignment.  The  employee sustained a tibia fracture when the steel pipe manifold fell over  unexpectedly."
06/19/2017,0653510,"At 3:30 p.m. on June 19, 2017, an employee was hoisting a cylinder on a  drilling rig site with the lines attached to a gin pole truck.  The employee  was struck a glancing blow in the head by the gin poles when the hoist lines  broke and was knocked into a 12 foot pit.  The employee suffered multiple  injuries to the head, back, spine, and foot.  The employee was hospitalized."
06/18/2017,0627500,"At 7:15 a.m. on June 18, 2017, an employee working on high pressure pump.  The  employee placed hand in the value cylinder when the brake was released and the  plunger/value smashed his hand. The employee injured his wrist and first  knuckle of his left hand and was hospitalized."
06/10/2017,0626000,"At 10:00 p.m. on June 10, 2017, an employee was working in a confined space,  removing an obstruction from two well holes. He was unable to acclimatize to  the heat and began showing signs of heat illness to include cramps, nausea,  disorientation, and weakness. Despite complaining of such symptoms, the  employee was encouraged to continue work. No medical attention was provided.  After the job was complete, the employee was taken to his residence, where he  experienced convulsions approximately 1.5 hours of arrival and died."
06/10/2017,0830300,"At 3:30 p.m. on June 10, 2017, Employee #1 had just finished a rod trip. The  rod caught the tongs and slipped out of the fingers. Employee #1 ran away from  the falling sucker rod, tripped and broke his leg."
06/09/2017,0627510,"At 4:00 p.m. on June 9, 2017, Employee #1, employed by a pipeline construction  company, was performing service on a pipe's blind valve.  He was removing the  blind from the valve when the valve failed.  Pressurized water propelled the  blind into Employee #1's chest.  The force of the impact caused chest trauma,  and Employee #1 was killed."
06/04/2017,0627510,"At 6:00 p.m. on June 4, 2017, an employee was standing on top of a tanker  truck to fill it with HCL. During filling, the employee breathed in the HCL  vapors, which made him ill.  The employee descended from where he was standing  to get some fresh air. Once he was feeling better, the employee accessed the  tanker truck again, going back to work. However, the employee began to feel  nauseous and began vomiting. The employee decided to go to the hospital, which  he drove himself. He was admitted to the hospital, where he was treated for  overexposure to the HCL vapors."
06/01/2017,0316400,"At 4:00 p.m. on June 1, 2017, an employee removed a section of the gun setting  tool that had just come up out of the well hole after setting off explosives  in the hole for fracturing.  The employee picked up a three foot section of  the sleeve and banged one end on the ground to dislodge the mandrel inside.  The employee did not realize that one of his fingers was partially inside a  hole in the side of the sleeve and, when the mandrel came down, it cut off the  end of his right middle finger that was inside the hole.  The employee was  hospitalized."
05/30/2017,0830500,"At 7:30 a.m. on May 30, 2017, Employee #1 was manually loosening bolts on a  wellhead flange while a coworker hit the bolts to heat them up and loosen them  with a 15 pound sledgehammer. The employee placed his hand on top of a bolt  and the coworker accidentally hit his hand while trying to hit the bolt.  Employee #1 sustained a fractured left middle finger and was hospitalized for  his injury."
05/29/2017,0627700,"At 1:30 p.m. on May 29, 2017, an employee was changing a seal on a power  swivel.  The rigging chain on the tong broke, striking the employee in the  side of his head. The employee suffered a fractured skull and was killed."
05/29/2017,0627510,"At 3:00 a.m. on May 29, 2017, an employee was connecting a wire cable to the  block of a drilling rig. The employee connecting a rope cable from a winch on  a pickup truck to the block of a drilling rig was entangled. The employee was  caught in between the cord and the winch and was killed.."
05/25/2017,0830500,"At 3:15 p.m. on May 25, 2017, an employee was welding on polycoated 2 in. pipe  in a trench at an oil and gas production tank battery.  An explosion occurred  and the employee received significant burns to the back, arms, and head."
05/25/2017,0830500,"At 3:15 p.m. on May 25, 2017, two employees were preparing hot plates to use  during fusion of plastic piping.  Other workers at the site were backfilling a  trench.  Other workers at the site were welding and using oxyacetylene torches  to connect steel piping in a trench.  The piping was connected to a crude oil  tank that had been partially emptied, but not washed out or vented.  Flammable  vapors ignited and three crude oil tanks exploded.  Flash fire spread to area  of trench, resulting in 4th degree burns and killing one worker. Three workers  sustained third degree burns and were hospitalized. Two workers sustained  first and second degree burns, and were treated and released."
05/25/2017,0830500,"At 3:30 p.m., an employee at an oil and gas production tank battery was  injured in an explosion."
05/24/2017,0316400,"At approximately 10:48 on May 24, 2017, Employee #1, the owner, and another  employee were in the process of neutralizing an empty MP85 odorant tank. The  odorant tank had previously been filed with tertiary butyl mercaptan.  The  odorant tank was filled with 6% sodium hypochlorite solution.  The group was  in the process of setting up the equipment to drain the odorant tank when the  odorant tank exploded.  The owner and Employee #1 were standing at the base of  the tank while the other employee was standing on a ladder.  Employee #1 and  the owner received fatal injuries, and the other employee was lift-flighted to  the hospital.  Employee #1 and the owner were pronounced dead at the scene."
05/23/2017,0627700,"At approximately 5:15 a.m. on May 23, 2017, Employee #1 and #2 were in an area  with flammable gas and production liquids. One of the employees was tightening  a bolt, when the bolt broke. Flammable material was released from the broken  bolt that ignited and produced a fire. The fire burned all of the employees.  Employee #1 received severe burns, whereas Employee #2 received less severe  burns. Both employee were transported to a medical center. At the hospital,  Employee #1 underwent burn treatment for his serious burns and was then  hospitalized. Employee #2 also underwent burn treatment at the hospital, but  was then released."
05/22/2017,0627510,"At 3:00 p.m. on May 22, 2017, an employee hit his right elbow as he slipped on  the second step of a stairwell. The employee had mud on bottom of boots due to  wet conditions from the previous day  and was swatting at bugs. The employee  did not want go to the hospital,  but his coworkers took him anyway. After  being admitted to the hospital and treated for his elbow, the employee was  released. However, while getting ready to leave, he started feeling dizzy and  had trouble catching his breath. The employee gasped for air and then suffered  a seizure/heart attack and later died."
05/19/2017,0552652,"At 3:00 p.m. on May 19, 2017, Employee #1 and Employee #2 were enlarging a  hole that was cut into the fender of a hot oil tanker truck.  Both employees  suffered first and second degree burns when combustible vapors in the area  ignited, burning each employee.  Hospitalization was not required."
05/11/2017,0627510,"At 7:30 a.m. on May 11, 2017, an employee was operating tongs while tripping  pipe out of a well hole while the well was being serviced. The safety pin  connecting the adjustable bar from the tongs broke, struck the employee, and  knocked the employee off the platform approximately 14 feet to the ground. The  employee sustained fractured ribs, a possible fractured back, and a possible  lacerated liver."
05/08/2017,0830500,"At 6:00 a.m. on May 8, 2017, an employee was turning off a diesel powered  light stand when an ignition source ignited flammable vapors from a nearby  open flowback tank.  The explosion resulted in the employee with burns on 30  percent of his body. The employee was hospitalized and treated for burn."
05/06/2017,0626000,"At 8:30 a.m. on May 6, 2017, an employee was working to attach a winch line  onto a hoist while the hoist was being operated. The hoist operator maneuvered  the equipment too quickly and the employee's right ring finger became caught  in a damaged identification tag. The finger was amputated, resulting in the  employee being hospitalized for treatment."
05/03/2017,0626000,"At 5:45 p.m. on May 3, 2017, Employee #1 pulled off a spout cap from a  pressurized salt water tank.The pressure caused the cap to strike the employee  in the chest, fracturing his ribs. Employee #1 was hospitalized for his  injuries."
05/01/2017,0830500,"At 12:45 p.m. on May 1, 2017, An employee was operating a vacuum truck hose.  The employee failed to close the block valve to block pressure and opened the  receiver hatch under pressure. The employee was in-line with the receiver. The  employee was struck by three pigs resulting in hospitalization with broken  legs."
04/30/2017,0626000,"At approximately 11:30 a.m. on April 30, 2017, an employee was working on a  rig floor unscrewing an oil field pipe with tong wrench.  The employee  unscrewed a section of pressurized pipe and it threw him off the working  floor. The employee landed on the ground. The tong wrench struck the oil field  pipe when the well pressure was released. The employee suffered from broken  leg and was hospitalized."
04/26/2017,0317500,"At approximately 10:30 a.m. on April 26, 2017, an employee was changing a slip  from 4-in. to 3-in. at the cellar. The operator had the brake applied to the  elevator in which a pipe and plate were hanging.  The operator left the  station and did not chain the brake in place.  The employee had his hand under  the bowl of the slip when the elevator gravitated down and struck top of the  slip pinching the employee's left ring finger between the bowl and the die.  The employee's left ring finger was crushed and amputated. The employee was  hospitalized and treated for his injuries."
04/18/2017,0625700,"On April 18, 2017, an employee was standing in front of the oil storage  tanker.  The employee was struck by the oil storage tanker cover/lid when the  tanker exploded and was killed. Two other employees were hospitalized for  unspecified injuries."
04/14/2017,0830500,"At 2:30 p.m. on April 14, 2017, an employee was using a commercial-rated power  washer to clean equipment that was used in oil/gas drilling.  The employee's  gloved right hand was in the way of the front discharge end over the nozzle  before depressing the release trigger on the washer end and the high pressure  water cut through his glove, leaving glove debris inside his finger.  The  employee was hospitalized for treatment."
04/10/2017,0627500,"At 8:00 p.m. on April 10, 2017, Employee #1 was driving a water hauling truck  and pulling a water tank trailer up a hill. The truck was unable to make it up  the hill, and the trailer jack-knifed. The employee went down the hill, and a  second truck was brought to the site to straighten the trailer and pull it  down the hill.  As the trailer was pulled, it rolled onto its side, and struck  Employee #1, breaking his upper right leg. The employee was hospitalized for  his injury."
04/08/2017,0830300,"At 1:00 p.m. on April 8, 2017, Employee #1 was conducting maintenance on a  propane truck. There was an explosion and fire and the employee was burned on  80 percent of his body. The employee was hospitalized for his injuries."
04/04/2017,0627510,"At approximately 1:00 p.m. on April 4, 2017, Employee #1 was rolling metal  pipe and performing a dry pipe inspection when he received a metal splinter in  his finger. He thought that he had removed the splinter, but the wound became  infected. Employee #1 went to a medical center, where he received treatment on  the metal punctured wound and was then hospitalized because of the severity of  the infected wound."
04/02/2017,0627700,"At 3:00 p.m. on April 2, 2017, an employee was climbing onto a drilling rig  skid. The employee grabbed a hydraulic cylinder to assist climbing onto the  drilling rig skid. The employee was struck by the hydraulic cylinder and  sustained amputation of the right leg."
04/02/2017,0627510,"At 7:15 a.m. on April 2, 2017, an employee was cleaning sand from a hopper.  The employee's fingers were caught-in the gate and the tips of the middle and  ring fingers were amputated."
03/27/2017,0627500,"At approximately 11:00 p.m. on March 27, 2017, Employee #1 was cleaning a  mixing tank.  The power was turned on and Employee #1 was struck by the  agitator and killed."
03/25/2017,0830500,"At 9:15 p.m. on March 25, 2017, an employee and a coworker were lifting a  Chicksan pipe weighing approximately 200 pounds from the transportation cradle  that it was delivered in.  The employee caught their finger between the cradle  and the pipe when the employee's coworker dropped the pipe. The employee  amputated their right middle fingertip to the mid-nail.  Hospitalization was  not required."
03/24/2017,0950647,"At 1:00 p.m. on March 24, 2017, an employee was working with three other  coworkers that were hydro-testing some tubing in a well.  The crew installed a  circulating head with a PGSR rubber to contain the gasses from the well but  first installed one that was too large.  They pulled it from the well and  replaced it with a smaller version; however, one of the coworkers opened the  slips while the employee was holding onto the API ring with their left hand.  The coworker lowered the elevator and the employee had their thumb pinched and  crushed between the API ring and the elevator.  The employee sustained a  partial amputation of their left thumb."
03/23/2017,0627510,"At approximately 9:45 a.m. on March 23, 2017, Employee #1 was bleeding off  pressure when he released too much pressure and the 2-inch pipe struck him.  Employee #1 suffered fractured ribs and two fractured vertebras and was  hospitalized."
03/14/2017,0626700,"At approximately 7:15 a.m. on March 14, 2017, Employee #1 was directing a  derrick work crew on how to un-set packer within an oil well.  The top half of  the derrick mast collapsed causing the traveling block to crash down striking  and killing Employee #1."
03/14/2017,0626700,"At approximately 7:15 a.m. on March 14, 2017, Employee #1 was directing a  derrick work crew on how to un-set packer within an oil well.  The top half of  the derrick mast collapsed causing the traveling block to crash down striking  and killing Employee #1."
03/11/2017,0317500,"At 10:30 a.m. on March 11, 2017, an employee was filling a pipe with fluid.  The employee was struck by a tool that fell from above and resulted in  amputating several fingers from the employee's left hand.  The employee was  hospitalized and treated for his injuries"
03/08/2017,0627700,"At 2:30 p.m. on March 8, 2017, Employee #1, employed by a company that  provided oil field services, was working on a pump jack, that is, a  reciprocating piston pump used to extract oil.  He was standing on top of a  ladder on the pump jack arm and reinstalling a horsehead at the end of the  arm.  Employee #1 was struck by the horsehead.  He fell to the ground below  the pump.  Emergency services were called, and Employee #1 was transported to  the hospital.  He was admitted and treated for fractures to his pelvis, cheek,  and jaw."
03/02/2017,0627510,"At 11:00 a.m. on March 2, 2017, Employee #1, the owner of the company, backed  the forklift onto a ramp that was connected to a trailer to inspect for leaks.  While he was inspecting it, the forklift rolled forward, pinning him  underneath the machine. Employee #1 sustained upper body injuries and was  killed."
02/27/2017,0950672,"On February 27, 2017, an employee was assisting in the servicing of a dryer.  As he was waiting for the soda ash to be loaded into the dryer and the  go-ahead by the dryer technician to connect a hose from the truck to the  dryer, steam was released. The employee sustained burns to his abdomen, back,  arms and face, which he was hospitalized and received treatment. He was  released 17 days later."
02/21/2017,0627500,"At 2:20 p.m. on February 21, 2017, an employee was driving a tanker truck to a  disposal yard. The employee lost control of the tanker truck going up a steep  hill on a private road which rolled over. The employee sustained numerous cuts  as the tanker truck rolled over the employee and was killed."
02/17/2017,0626000,"At approximately 11:00 a.m. on February 17, 2017, an employee was going to  remove a bleeder valve from the skid. When the employee removed the plug high  pressure exceeding 1,100 psi, shot out and caused the employee to be blown  back. The employee sustained injuries to his leg (puncture), a broken left  arm, and skull fracture to both sides of his face. The employee was  hospitalized and treated for his injuries."
02/16/2017,0627700,"At 9:00 a.m. on February 16, 2017, an employee was turning a master valve on a  gas wellhead when it exploded and threw the employee a distance away.  The  employees pants caught on fire during the wellhead explosion and suffered  third degree burns to both legs. The employee was hospitalized and treated for  his injuries."
02/09/2017,0625700,"At 6:30 p.m. on February 9, 2017, an employee was working at a natural gas  pipeline. As he opened one of the valves on the pipeline, a fire occurred. The  employee sustained multiple burns, which he was hospitalized and received  treatment."
02/05/2017,0728900,"On February 5, 2017, Employee #1 was at an oil collection site which consisted  of an earthen dike around six tanks positioned from North to South.  Employee  #1's Dodge pickup was located at the bottom of the steps on the South side of  the tanks.  He was discovered unresponsive, slumped backwards on his knees on  the North end of a catwalk dead of unknown causes."
02/02/2017,0627510,"At approximately 6:00 p.m. on February 2, 2017, an employee was walking across  the substructure, fell to the ground, and was killed."
02/01/2017,0830500,"At 11:30 a.m. on February 1, 2017, an employee was using high pressure water  hose to excavate dirt. The left foot of the operator of the high pressure  water vac truck slipped into the water stream and this caused an amputation of  the employee's left foot middle toe."
01/31/2017,0626600,"At approximately 10:30 a.m. on January 31, 2017, an employee was cutting the  main drill cable at the crown of an oil derrick. The employee was struck by a  cable and fell from a height. He suffered head trauma and multiple fractures  and was killed."
01/31/2017,0627510,"At 1:30 p.m. on January 31, 2017, an employee's hand was caught between the  blow-out preventer and elevator. The employee sustained lacerations and  fractured his hand. The employee was hospitalized."
01/30/2017,0729700,"At 12:30 p.m. on January 30, 2017, an employee was repairing the head switch  of the primary motor control center at an oil pumping site. The oil pump motor  control center and the saltwater motor control center were not labeled as to  what circuits were either controlled by them and/or passed through them. The  motor control center was secured in anticipation of replacing the head switch.  The employee opened a nearby junction box to perform the initial disconnection  of wiring to the switch. The employee came into contact with a 480 volt unused  circuit that passed through the motor control center. This 480 volt circuit  was not de-energized by the cutout used to secure the motor control center and  the employee did not test the circuits within the junction box to ensure they  were all de-energized and sustained extensive electrical burns to the right  hand and less serious burns to the left."
01/30/2017,0627700,"At 4:30 p.m. on January 30, 2017, an employee was investigating wire rope that  was loose and was going to get tangled into the elevator. The employee pulled  the sheave and the employee's hand was pulled into sheave. The employee  sustained amputation to four fingers on the right hand."
01/30/2017,0626000,"At approximately 11:00 a.m. on January 30, 2017, Employee #1 was trying to get  a well head back on line by operating a valve to see if there would flow.  The  threads on the 2-inch flow line valve appeared to have been cross threaded  causing the fitting to break apart and it struck Employee #1 in the hip.  Employee #1 was hospitalized with a fractured hip and a laceration above his  ear."
01/27/2017,0625500,"At 10:00 a.m. on January 27, 2017, two employees were operating a pump truck,  when a vessel exploded.  Both employees were hospitalized and one was treated  for a burst eardrum."
01/20/2017,0830300,"At 4:00 p.m. on January 20, 2017, an employee was driving a Genie Lift up a  truck ramp when it slipped off the ramp and tipped over.  The employee did not  have on a safety harness and was thrown from the Genie Lift and sustained a  broken leg.  The employee was hospitalized and treated for his injuries."
